model_comparison.csv

ML Model Name,Accuracy,AUC,Precision,Recall,F1,MCC
Logistic Regression,0.8869315854158132,0.8995738286007797,0.7523809523809524,0.41361256544502617,0.5337837837837838,0.5031902489865522
Decision Tree,0.85661614092585,0.7380406286790975,0.54,0.5654450261780105,0.5524296675191815,0.4672931781940782
KNN,0.8734125358459648,0.7957803691620748,0.6622222222222223,0.3900523560209424,0.49093904448105435,0.44353934223355135
Naive Bayes,0.2773453502662843,0.7502460148142873,0.1755868544600939,0.9790575916230366,0.29777070063694266,0.13753260532646558
Support Vector Machine,0.8955346169602622,0.8728770892188299,0.7360594795539034,0.518324607329843,0.6082949308755761,0.5613803839126179

README.md

### Logistic Regression

Logistic Regression gave an accuracy of 88.69% and the highest AUC of 0.8996 among all five models.

Its precision was also the highest at 0.7524. However, recall was only 0.4136, which means it was not able to identify many of the actual purchase cases.

### Decision Tree

However, its AUC was 0.7380, which was the lowest among the five models.

### K-Nearest Neighbors (KNN)

Its precision was 0.6622, but recall was comparatively low at 0.3901. This means it missed many actual purchase cases.

Its F1 Score was 0.4909, which was lower than Logistic Regression, Decision Tree, and SVM.

### Gaussian Naive Bayes

It achieved the highest recall of 0.9791, which means it identified almost all actual purchase cases.

However, its precision was only 0.1756, indicating that many non-purchase cases were incorrectly predicted as purchases.

### Support Vector Machine (SVM)

SVM achieved the highest accuracy of 89.55% among the five models.

It also gave the highest F1 Score of 0.6083 and MCC of 0.5614.

Its precision was 0.7361 and recall was 0.5183. Although recall was not the highest, the model gave the best overall performance based on the selected evaluation criteria.

## 8. Best Performing Model

- It achieved the highest accuracy of 89.55%.
- It had the highest F1 Score of 0.6083.
- It also achieved the highest MCC of 0.5614.